{
  "version": "1.0.0",
  "generated_at_utc": "2025-10-20T19:54:12Z",
  "company": {
    "name": "CVB FINANCIAL CORP.",
    "ticker": "CVBF",
    "cik": "0000354647"
  },
  "filing": {
    "form": "DEF 14A",
    "accession_number": "0000950170-25-051966",
    "filing_date": "2025-04-08",
    "edgar_urls": {
      "index": "https://www.sec.gov/Archives/edgar/data/354647/000095017025051966/0000950170-25-051966-index.htm",
      "primary_doc": "https://www.sec.gov/Archives/edgar/data/354647/000095017025051966/cvbf-20250405.htm"
    }
  },
  "board": {
    "size": 8,
    "independent_count": 8,
    "leadership": {
      "chair_is_independent": false,
      "ceo_is_chair": false
    }
  },
  "ownership": {
    "top_holders": [],
    "top5_pct": 0.0,
    "insider_pct": 0.0,
    "policies": {}
  },
  "compensation": {
    "pay_mix_pct": {},
    "neos": [
      {
        "role": "CEO",
        "name": "David A. Brager",
        "total_comp_usd": null
      }
    ],
    "annual_incentive": {},
    "ltip": {},
    "say_on_pay_pct": null
  },
  "equity_plan": {
    "overhang_pct": null,
    "burn_rate_pct": null,
    "shares_available": null,
    "shares_outstanding_awards": null,
    "plan_name": null
  },
  "audit": {
    "auditor": "KPMG LLP",
    "fees": {}
  },
  "provenance": [
    {
      "section": "board.size",
      "method": "regex",
      "locators": [
        "regex: elect (\\d+) persons to the board"
      ],
      "page_range": null,
      "text_snippet": "s on the audio call. At our annual meeting, we will ask you to act on the following matters: 1. Election of Directors . Elect eight (8) persons to the Board of Directors to serve for a term of one year and until their successors are elected and qualified. The following eight",
      "confidence_pct": 90,
      "source_url": "https://www.sec.gov/Archives/edgar/data/354647/000095017025051966/cvbf-20250405.htm",
      "sha256": "fe2a2463104b9a524660a8f36d015ae961cc4243300fc123000fe08ce8693516"
    },
    {
      "section": "compensation.neos[0].name",
      "method": "html_parse",
      "locators": [
        "table header: Name and Principal Position"
      ],
      "page_range": null,
      "text_snippet": "David A. Brager 2024 879,039 686,250 1,237,496 - 237,900 - 76,530 3,117,215",
      "confidence_pct": 95,
      "source_url": "https://www.sec.gov/Archives/edgar/data/354647/000095017025051966/cvbf-20250405.htm",
      "sha256": "fe2a2463104b9a524660a8f36d015ae961cc4243300fc123000fe08ce8693516"
    },
    {
      "section": "audit.auditor",
      "method": "regex",
      "locators": [
        "text contains: kpmg(?:\\s+llp)?"
      ],
      "page_range": null,
      "text_snippet": "voting power on certain matters. Brokers or other nominees have discretionary voting power for Proposal 3 (approval of KPMG LLP as independent auditor), but not for Proposal 1 (election of directors) or Proposal 2 (Say-On-Pay). It is therefore imp",
      "confidence_pct": 90,
      "source_url": "https://www.sec.gov/Archives/edgar/data/354647/000095017025051966/cvbf-20250405.htm",
      "sha256": "fe2a2463104b9a524660a8f36d015ae961cc4243300fc123000fe08ce8693516"
    }
  ]
}